{"dataset":{"identity":"intlify-locale-canonicalization-fixture","schema":{"identity":"intlify-locale-canonicalization-dataset","revision":"0"},"semanticDigest":"sha256:555271894016e7cbebf034ad23fecacd2e9453c5a1feb79dd8266f9d5ff57a29"},"generation":{"cldr":{"revision":"48.2.0","sources":[{"address":"common/bcp47/calendar.xml","digest":"sha256:fb24616f77fac1ab3246f869b69efc8a4b86d2437a947f3f6a53843ac0b60821"},{"address":"common/validity/region.xml","digest":"sha256:e751e0eedd46b52c38f3cdb72b0fab61ac8b48e052e8b28ba74b6ac26c4c8cb1"}]},"markerData":{"checksum":"sha256:d5fdcc9ac77c6d74ff5cf6e65ef3181d6af32003b16fce3a77fb451d2f695993","package":"icu_locale_data","version":"2.2.0"},"markers":["LocaleAliasesV1","LocaleLikelySubtagsExtendedV1","LocaleLikelySubtagsLanguageV1","LocaleLikelySubtagsScriptRegionV1"]},"integrityDigest":"sha256:38d57db3cbda5d4ef427a5b4d3d6e65182df9ec6b21335281c9e26185c15d75c","kind":"locale-canonicalization-data","payloads":[{"address":"conformance.json","byteLength":"1521","digest":"sha256:d09c253b2c24d59c2ef51471f5bd67503049e2e18a3b9c53cf8631264d5a51e1","format":{"identity":"intlify-canonical-json-text","revision":"0"},"role":"conformance"},{"address":"markers-narrow.postcard","byteLength":"566","digest":"sha256:2147a07563352f61577e1170695fb097987a64b6a2072846babb241b5714df07","format":{"identity":"icu4x-blob","revision":"2.2"},"role":"markers"}],"schemaRevision":"0","specification":{"identity":"intlify-locale-canonicalization","revision":"0"}}